{
  "schema_version": "1.2",
  "character_id": "demo_historical_001",
  "identity_version": 1,
  "look_id": "fictional_court_robe",
  "look_version": 1,
  "condition_id": "neutral",
  "board_version": 1,
  "project_state": "spec_locked",
  "rendering_style": "photoreal",
  "spec_revision": 1,
  "reference_registry": [{"reference_id": "ref_face_001", "asset_path": "../generated/historical-fantasy-board-v1.3.png", "role": ["identity", "costume"], "scope": ["face", "look"], "source": "generated", "limitations": ["架空影视造型，不代表历史考据"]}],
  "part_coverage": [
    {"part_id": "headpiece_01", "required_by": "design", "anatomical_side": "center", "attachment_location": "hair_bun", "visible_in": ["front", "left_profile", "back"], "occluded_in": [], "coverage_cells": ["front", "back", "detail_headpiece_01"], "detail_priority": "required", "reference_source": "design_completion", "qa_status": "pending"},
    {"part_id": "belt_01", "required_by": "design", "anatomical_side": "center", "attachment_location": "waist", "visible_in": ["front", "left_profile", "back"], "occluded_in": [], "coverage_cells": ["front", "detail_belt_01"], "detail_priority": "required", "reference_source": "design_completion", "qa_status": "pending"}
  ],
  "view_tasks": [],
  "review_method": null,
  "user_approved": false,
  "inputs": {"identity_reference": "ref_face_001", "additional_references": [], "user_requirements": ["架空古装", "复杂头饰", "展示背面结构"], "output_mode": "generate", "board_content": "asset_board"},
  "routing": {"genre": "fictional-historical", "genre_source": "user", "era": null, "profiles": ["historical-complex"], "inference_notes": ["未指定朝代，明确使用架空古装"]},
  "identity": {"reference_id": "ref_face_001", "features": [{"id": "demo_identity", "description": "仅供虚构演示", "source": "design_completion", "visibility": "visible", "lock_policy": "strict"}], "lock_status": "provisional", "input_quality": "usable"},
  "body": {"height_cm": null, "proportions": "natural", "source": "design_default"},
  "costume": {"layers": [{"id": "inner_01", "description": "米白交领内层"}, {"id": "outer_01", "description": "黛青广袖外层"}], "hair": {"id": "hair_01", "description": "高盘发，背面发髻清晰"}, "headwear": [{"id": "headpiece_01", "description": "中心金属发冠"}], "accessories": [{"id": "belt_01", "description": "深红织带腰封"}], "footwear": {"id": "shoe_01", "description": "深色布靴"}, "front_structure": {"description": "交领与腰封"}, "side_structure": {"description": "广袖层次"}, "back_structure": {"description": "发髻与外袍后中结构"}, "forbidden_additions": ["具体朝代徽记", "披帛", "玉佩堆叠"]},
  "complexity": {"dimensions": {"clothing_layers": 2, "head_design": 2, "patterns_materials": 1, "accessories_props": 1, "side_asymmetry": 0, "occlusion_back": 2}, "score": 8, "tier": "complex", "required_details": ["headpiece_01", "belt_01"]},
  "board": {"mode": "auto", "layout_id": "landscape_top_views_bottom_details_complex", "detail_level": "enhanced", "orientation": "landscape", "aspect_ratio": [16, 9], "outer_frame": {"enabled": true, "color": "#FFFFFF", "width_px": 88}, "inner_background": "#F4F5F6", "upper_region_width_ratios": [0.62, 0.38], "content_height_ratios": [0.685, 0.315], "detail_placement": "bottom", "labels": {"enabled": true, "language": "zh-CN", "section_titles_enabled": true, "per_cell_labels_enabled": true, "position": "outside_image", "cell_label_height_px": 48, "title_color": "#30343B", "label_color": "#4B515B"}, "required_detail_categories": ["eyes_brows", "nose_lips", "footwear_or_feet"], "body_views": ["front", "left_profile", "back", "left_three_quarter"], "face_views": ["front", "left_three_quarter", "left_profile"], "detail_ids": ["eyes_brows", "nose_lips", "headpiece_01", "belt_01", "hair_back", "neckline_layers", "sleeve_structure", "waist_structure", "footwear_three_quarter", "footwear_profile"], "target_canvas": [7680, 4320], "actual_canvas": null},
  "generation": {"strategy": "anchor_then_views", "adapter": "host-image-tool", "anchor_asset_id": null, "budget": {"max_image_requests": 24, "max_total_repairs": 6, "max_repairs_per_unit": 2}, "calls": []},
  "qa": {"status": "pending", "checks": [], "unverified_items": ["展示图为一次生成资产板，跨格一致性需人工复核"]},
  "artifacts": []
}
